{
  "$ref": "#/definitions/gallery",
  "definitions": {
    "gallery": {
      "type": "object",
      "properties": {
        "title": {
          "type": "string"
        },
        "description": {
          "type": "string"
        },
        "date": {
          "anyOf": [
            {
              "type": "string",
              "format": "date-time"
            },
            {
              "type": "string",
              "format": "date"
            },
            {
              "type": "integer",
              "format": "unix-time"
            }
          ]
        },
        "coverImage": {
          "type": "string"
        },
        "images": {
          "type": "array",
          "items": {
            "type": "object",
            "properties": {
              "src": {
                "type": "string"
              },
              "alt": {
                "type": "string"
              },
              "caption": {
                "type": "string"
              }
            },
            "required": [
              "src",
              "alt"
            ],
            "additionalProperties": false
          }
        },
        "$schema": {
          "type": "string"
        }
      },
      "required": [
        "title",
        "coverImage",
        "images"
      ],
      "additionalProperties": false
    }
  },
  "$schema": "http://json-schema.org/draft-07/schema#"
}