{
    "title": "Modern LVP Basement Transformation",
    "description": "Converted a damp, concrete basement into a warm, comfortable living space using premium waterproof Luxury Vinyl Plank.",
    "date": "2024-01-20T00:00:00.000Z",
    "coverImage": "https://images.unsplash.com/photo-1600585154340-be6161a56a0c?ixlib=rb-4.0.3&auto=format&fit=crop&w=1000&q=80",
    "images": [
        {
            "src": "https://images.unsplash.com/photo-1600585154340-be6161a56a0c?ixlib=rb-4.0.3&auto=format&fit=crop&w=1200&q=80",
            "alt": "Wide shot of the new basement floor",
            "caption": "Wide open play space with highly durable LVP."
        },
        {
            "src": "https://images.unsplash.com/photo-1600566753376-12c8ab7fb75b?ixlib=rb-4.0.3&auto=format&fit=crop&w=1200&q=80",
            "alt": "Stair integration",
            "caption": "Custom nosing to match the LVP seamlessly on the bottom step."
        }
    ]
}